<?xml version="1.0" encoding="UTF-8"?>

<xsd:schema 
xmlns:xsd="http://www.w3.org/2001/XMLSchema"
targetNamespace="http://www.ineasysteps.com/nikon" xmlns:n="http://www.ineasysteps.com/nikon" >

<!-- DECLARE ELEMENTS. -->

<!-- Simple type. -->
<xsd:element name = "version" type = "xsd:string" />
<xsd:element name = "model" type = "xsd:string" />

<!-- Complex type. -->
<xsd:element name="doc" type="n:docType"/>
<xsd:element name="camera" type="n:cameraType"/>


<!-- DEFINE STRUCTURES. -->

<xsd:complexType name="docType">
	<xsd:sequence>
		<xsd:element ref="n:camera" maxOccurs="unbounded"/>
	</xsd:sequence>
</xsd:complexType>
	
<xsd:complexType name="cameraType">
	<xsd:sequence>
		<xsd:element ref="n:version" />
		<xsd:element ref="n:model" />
	</xsd:sequence>
</xsd:complexType>
	

</xsd:schema>
